root@ubuntu-gbc-cs-comp3134:~# tcpdump -n -i eth0
tcpdump: verbose output suppressed, use -v[v]... for full protocol decode
listening on eth0, link-type EN10MB (Ethernet), snapshot length 262144 bytes
04:56:28.558491 IP 138.197.171.102.22 > 162.243.188.66.9029: Flags [P.], seq 960221759:960221887, ack 2055542720, win 502, options [nop,nop,TS val 1273262742 ecr 3283403063], length 128
04:56:28.558662 IP 138.197.171.102.22 > 162.243.188.66.9029: Flags [P.], seq 128:272, ack 1, win 502, options [nop,nop,TS val 1273262742 ecr 3283403063], length 144
04:56:28.558821 IP 138.197.171.102.22 > 162.243.188.66.9029: Flags [P.], seq 272:432, ack 1, win 502, options [nop,nop,TS val 1273262742 ecr 3283403063], length 160
04:56:28.559003 IP 138.197.171.102.22 > 162.243.188.66.9029: Flags [P.], seq 432:496, ack 1, win 502, options [nop,nop,TS val 1273262742 ecr 3283403063], length 64
04:56:28.572704 IP 162.243.188.66.9029 > 138.197.171.102.22: Flags [.], ack 128, win 501, options [nop,nop,TS val 3283403083 ecr 1273262742], length 0
04:56:28.572705 IP 162.243.188.66.9029 > 138.197.171.102.22: Flags [.], ack 272, win 501, options [nop,nop,TS val 3283403083 ecr 1273262742], length 0
04:56:28.572809 IP 162.243.188.66.9029 > 138.197.171.102.22: Flags [.], ack 432, win 501, options [nop,nop,TS val 3283403083 ecr 1273262742], length 0
04:56:28.573508 IP 162.243.188.66.9029 > 138.197.171.102.22: Flags [.], ack 496, win 501, options [nop,nop,TS val 3283403084 ecr 1273262742], length 0
04:56:28.647667 IP 138.197.171.102.22 > 162.243.188.66.9029: Flags [P.], seq 496:736, ack 1, win 502, options [nop,nop,TS val 1273262831 ecr 3283403084], length 240
04:56:28.647839 IP 138.197.171.102.22 > 162.243.188.66.9029: Flags [P.], seq 736:1024, ack 1, win 502, options [nop,nop,TS val 1273262831 ecr 3283403084], length 288
04:56:28.647982 IP 138.197.171.102.22 > 162.243.188.66.9029: Flags [P.], seq 1024:1088, ack 1, win 502, options [nop,nop,TS val 1273262831 ecr 3283403084], length 64
04:56:28.648012 IP 138.197.171.102.22 > 162.243.188.66.9029: Flags [P.], seq 1088:1312, ack 1, win 502, options [nop,nop,TS val 1273262831 ecr 3283403084], length 224
04:56:28.648113 IP 138.197.171.102.22 > 162.243.188.66.9029: Flags [P.], seq 1312:1376, ack 1, win 502, options [nop,nop,TS val 1273262832 ecr 3283403084], length 64
04:56:28.648214 IP 138.197.171.102.22 > 162.243.188.66.9029: Flags [P.], seq 1376:1664, ack 1, win 502, options [nop,nop,TS val 1273262832 ecr 3283403084], length 288
04:56:28.648319 IP 138.197.171.102.22 > 162.243.188.66.9029: Flags [P.], seq 1664:1872, ack 1, win 502, options [nop,nop,TS val 1273262832 ecr 3283403084], length 208
04:56:28.648421 IP 138.197.171.102.22 > 162.243.188.66.9029: Flags [P.], seq 1872:1936, ack 1, win 502, options [nop,nop,TS val 1273262832 ecr 3283403084], length 64
04:56:28.648540 IP 138.197.171.102.22 > 162.243.188.66.9029: Flags [P.], seq 1936:2208, ack 1, win 502, options [nop,nop,TS val 1273262832 ecr 3283403084], length 272
04:56:28.648640 IP 138.197.171.102.22 > 162.243.188.66.9029: Flags [P.], seq 2208:2416, ack 1, win 502, options [nop,nop,TS val 1273262832 ecr 3283403084], length 208
04:56:28.661844 IP 162.243.188.66.9029 > 138.197.171.102.22: Flags [.], ack 736, win 501, options [nop,nop,TS val 3283403172 ecr 1273262831], length 0
04:56:28.661908 IP 138.197.171.102.22 > 162.243.188.66.9029: Flags [P.], seq 2416:2752, ack 1, win 502, options [nop,nop,TS val 1273262845 ecr 3283403172], length 336
04:56:28.661937 IP 162.243.188.66.9029 > 138.197.171.102.22: Flags [.], ack 1024, win 501, options [nop,nop,TS val 3283403172 ecr 1273262831], length 0
04:56:28.661937 IP 162.243.188.66.9029 > 138.197.171.102.22: Flags [.], ack 1088, win 501, options [nop,nop,TS val 3283403172 ecr 1273262831], length 0
04:56:28.662112 IP 162.243.188.66.9029 > 138.197.171.102.22: Flags [.], ack 1312, win 501, options [nop,nop,TS val 3283403172 ecr 1273262831], length 0
04:56:28.662126 IP 162.243.188.66.9029 > 138.197.171.102.22: Flags [.], ack 1376, win 501, options [nop,nop,TS val 3283403172 ecr 1273262832], length 0
04:56:28.662285 IP 162.243.188.66.9029 > 138.197.171.102.22: Flags [.], ack 1664, win 499, options [nop,nop,TS val 3283403173 ecr 1273262832], length 0
04:56:28.662382 IP 162.243.188.66.9029 > 138.197.171.102.22: Flags [.], ack 1872, win 498, options [nop,nop,TS val 3283403173 ecr 1273262832], length 0
04:56:28.662383 IP 162.243.188.66.9029 > 138.197.171.102.22: Flags [.], ack 1936, win 498, options [nop,nop,TS val 3283403173 ecr 1273262832], length 0
04:56:28.662504 IP 162.243.188.66.9029 > 138.197.171.102.22: Flags [.], ack 2208, win 496, options [nop,nop,TS val 3283403173 ecr 1273262832], length 0
04:56:28.662574 IP 162.243.188.66.9029 > 138.197.171.102.22: Flags [.], ack 2416, win 495, options [nop,nop,TS val 3283403173 ecr 1273262832], length 0
04:56:28.675912 IP 162.243.188.66.9029 > 138.197.171.102.22: Flags [.], ack 2752, win 501, options [nop,nop,TS val 3283403186 ecr 1273262845], length 0
04:56:28.751456 IP 138.197.171.102.22 > 162.243.188.66.9029: Flags [P.], seq 2752:2976, ack 1, win 502, options [nop,nop,TS val 1273262935 ecr 3283403186], length 224
04:56:28.751682 IP 138.197.171.102.22 > 162.243.188.66.9029: Flags [P.], seq 2976:3264, ack 1, win 502, options [nop,nop,TS val 1273262935 ecr 3283403186], length 288
04:56:28.751888 IP 138.197.171.102.22 > 162.243.188.66.9029: Flags [P.], seq 3264:3616, ack 1, win 502, options [nop,nop,TS val 1273262935 ecr 3283403186], length 352
04:56:28.752068 IP 138.197.171.102.22 > 162.243.188.66.9029: Flags [P.], seq 3616:3904, ack 1, win 502, options [nop,nop,TS val 1273262935 ecr 3283403186], length 288
04:56:28.752271 IP 138.197.171.102.22 > 162.243.188.66.9029: Flags [P.], seq 3904:4128, ack 1, win 502, options [nop,nop,TS val 1273262936 ecr 3283403186], length 224
04:56:28.752383 IP 138.197.171.102.22 > 162.243.188.66.9029: Flags [P.], seq 4128:4192, ack 1, win 502, options [nop,nop,TS val 1273262936 ecr 3283403186], length 64
04:56:28.752455 IP 138.197.171.102.22 > 162.243.188.66.9029: Flags [P.], seq 4192:4416, ack 1, win 502, options [nop,nop,TS val 1273262936 ecr 3283403186], length 224
04:56:28.752531 IP 138.197.171.102.22 > 162.243.188.66.9029: Flags [P.], seq 4416:4480, ack 1, win 502, options [nop,nop,TS val 1273262936 ecr 3283403186], length 64
04:56:28.752615 IP 138.197.171.102.22 > 162.243.188.66.9029: Flags [P.], seq 4480:4704, ack 1, win 502, options [nop,nop,TS val 1273262936 ecr 3283403186], length 224
04:56:28.752695 IP 138.197.171.102.22 > 162.243.188.66.9029: Flags [P.], seq 4704:4768, ack 1, win 502, options [nop,nop,TS val 1273262936 ecr 3283403186], length 64
04:56:28.752779 IP 138.197.171.102.22 > 162.243.188.66.9029: Flags [P.], seq 4768:5056, ack 1, win 502, options [nop,nop,TS val 1273262936 ecr 3283403186], length 288
04:56:28.752884 IP 138.197.171.102.22 > 162.243.188.66.9029: Flags [P.], seq 5056:5280, ack 1, win 502, options [nop,nop,TS val 1273262936 ecr 3283403186], length 224
04:56:28.752983 IP 138.197.171.102.22 > 162.243.188.66.9029: Flags [P.], seq 5280:5344, ack 1, win 502, options [nop,nop,TS val 1273262936 ecr 3283403186], length 64
04:56:28.753083 IP 138.197.171.102.22 > 162.243.188.66.9029: Flags [P.], seq 5344:5568, ack 1, win 502, options [nop,nop,TS val 1273262936 ecr 3283403186], length 224
04:56:28.753150 IP 138.197.171.102.22 > 162.243.188.66.9029: Flags [P.], seq 5568:5632, ack 1, win 502, options [nop,nop,TS val 1273262937 ecr 3283403186], length 64
04:56:28.753347 IP 138.197.171.102.22 > 162.243.188.66.9029: Flags [P.], seq 5632:5840, ack 1, win 502, options [nop,nop,TS val 1273262937 ecr 3283403186], length 208
04:56:28.753439 IP 138.197.171.102.22 > 162.243.188.66.9029: Flags [P.], seq 5840:5904, ack 1, win 502, options [nop,nop,TS val 1273262937 ecr 3283403186], length 64
04:56:28.753531 IP 138.197.171.102.22 > 162.243.188.66.9029: Flags [P.], seq 5904:6192, ack 1, win 502, options [nop,nop,TS val 1273262937 ecr 3283403186], length 288
04:56:28.753624 IP 138.197.171.102.22 > 162.243.188.66.9029: Flags [P.], seq 6192:6464, ack 1, win 502, options [nop,nop,TS val 1273262937 ecr 3283403186], length 272
04:56:28.753713 IP 138.197.171.102.22 > 162.243.188.66.9029: Flags [P.], seq 6464:6736, ack 1, win 502, options [nop,nop,TS val 1273262937 ecr 3283403186], length 272
04:56:28.753797 IP 138.197.171.102.22 > 162.243.188.66.9029: Flags [P.], seq 6736:6944, ack 1, win 502, options [nop,nop,TS val 1273262937 ecr 3283403186], length 208
04:56:28.771814 IP 162.243.188.66.9029 > 138.197.171.102.22: Flags [.], ack 6944, win 469, options [nop,nop,TS val 3283403282 ecr 1273262935], length 0
04:56:28.771869 IP 138.197.171.102.22 > 162.243.188.66.9029: Flags [P.], seq 6944:8912, ack 1, win 502, options [nop,nop,TS val 1273262955 ecr 3283403282], length 1968
04:56:28.785877 IP 162.243.188.66.9029 > 138.197.171.102.22: Flags [.], ack 8912, win 454, options [nop,nop,TS val 3283403296 ecr 1273262955], length 0
04:56:28.855364 IP 138.197.171.102.22 > 162.243.188.66.9029: Flags [P.], seq 8912:9136, ack 1, win 502, options [nop,nop,TS val 1273263039 ecr 3283403296], length 224
04:56:28.855494 IP 138.197.171.102.22 > 162.243.188.66.9029: Flags [P.], seq 9136:9424, ack 1, win 502, options [nop,nop,TS val 1273263039 ecr 3283403296], length 288
04:56:28.855643 IP 138.197.171.102.22 > 162.243.188.66.9029: Flags [P.], seq 9424:9488, ack 1, win 502, options [nop,nop,TS val 1273263039 ecr 3283403296], length 64
04:56:28.855678 IP 138.197.171.102.22 > 162.243.188.66.9029: Flags [P.], seq 9488:9712, ack 1, win 502, options [nop,nop,TS val 1273263039 ecr 3283403296], length 224
04:56:28.855773 IP 138.197.171.102.22 > 162.243.188.66.9029: Flags [P.], seq 9712:9776, ack 1, win 502, options [nop,nop,TS val 1273263039 ecr 3283403296], length 64
04:56:28.855848 IP 138.197.171.102.22 > 162.243.188.66.9029: Flags [P.], seq 9776:10000, ack 1, win 502, options [nop,nop,TS val 1273263039 ecr 3283403296], length 224
04:56:28.855954 IP 138.197.171.102.22 > 162.243.188.66.9029: Flags [P.], seq 10000:10288, ack 1, win 502, options [nop,nop,TS val 1273263039 ecr 3283403296], length 288
04:56:28.856056 IP 138.197.171.102.22 > 162.243.188.66.9029: Flags [P.], seq 10288:10640, ack 1, win 502, options [nop,nop,TS val 1273263039 ecr 3283403296], length 352
04:56:28.856139 IP 138.197.171.102.22 > 162.243.188.66.9029: Flags [P.], seq 10640:10864, ack 1, win 502, options [nop,nop,TS val 1273263040 ecr 3283403296], length 224
04:56:28.856218 IP 138.197.171.102.22 > 162.243.188.66.9029: Flags [P.], seq 10864:11152, ack 1, win 502, options [nop,nop,TS val 1273263040 ecr 3283403296], length 288
04:56:28.856313 IP 138.197.171.102.22 > 162.243.188.66.9029: Flags [P.], seq 11152:11440, ack 1, win 502, options [nop,nop,TS val 1273263040 ecr 3283403296], length 288
04:56:28.856417 IP 138.197.171.102.22 > 162.243.188.66.9029: Flags [P.], seq 11440:11504, ack 1, win 502, options [nop,nop,TS val 1273263040 ecr 3283403296], length 64
04:56:28.856527 IP 138.197.171.102.22 > 162.243.188.66.9029: Flags [P.], seq 11504:11792, ack 1, win 502, options [nop,nop,TS val 1273263040 ecr 3283403296], length 288
04:56:28.856640 IP 138.197.171.102.22 > 162.243.188.66.9029: Flags [P.], seq 11792:12080, ack 1, win 502, options [nop,nop,TS val 1273263040 ecr 3283403296], length 288
04:56:28.856737 IP 138.197.171.102.22 > 162.243.188.66.9029: Flags [P.], seq 12080:12304, ack 1, win 502, options [nop,nop,TS val 1273263040 ecr 3283403296], length 224
04:56:28.856845 IP 138.197.171.102.22 > 162.243.188.66.9029: Flags [P.], seq 12304:12656, ack 1, win 502, options [nop,nop,TS val 1273263040 ecr 3283403296], length 352
04:56:28.856950 IP 138.197.171.102.22 > 162.243.188.66.9029: Flags [P.], seq 12656:12880, ack 1, win 502, options [nop,nop,TS val 1273263040 ecr 3283403296], length 224
04:56:28.857050 IP 138.197.171.102.22 > 162.243.188.66.9029: Flags [P.], seq 12880:13168, ack 1, win 502, options [nop,nop,TS val 1273263040 ecr 3283403296], length 288
04:56:28.857358 IP 138.197.171.102.22 > 162.243.188.66.9029: Flags [P.], seq 13168:13520, ack 1, win 502, options [nop,nop,TS val 1273263041 ecr 3283403296], length 352
04:56:28.857488 IP 138.197.171.102.22 > 162.243.188.66.9029: Flags [P.], seq 13520:14032, ack 1, win 502, options [nop,nop,TS val 1273263041 ecr 3283403296], length 512
04:56:28.857613 IP 138.197.171.102.22 > 162.243.188.66.9029: Flags [P.], seq 14032:14384, ack 1, win 502, options [nop,nop,TS val 1273263041 ecr 3283403296], length 352
04:56:28.857765 IP 138.197.171.102.22 > 162.243.188.66.9029: Flags [P.], seq 14384:14608, ack 1, win 502, options [nop,nop,TS val 1273263041 ecr 3283403296], length 224
04:56:28.857901 IP 138.197.171.102.22 > 162.243.188.66.9029: Flags [P.], seq 14608:14896, ack 1, win 502, options [nop,nop,TS val 1273263041 ecr 3283403296], length 288
04:56:28.858125 IP 138.197.171.102.22 > 162.243.188.66.9029: Flags [P.], seq 14896:15456, ack 1, win 502, options [nop,nop,TS val 1273263042 ecr 3283403296], length 560
04:56:28.858213 IP 138.197.171.102.22 > 162.243.188.66.9029: Flags [P.], seq 15456:15728, ack 1, win 502, options [nop,nop,TS val 1273263042 ecr 3283403296], length 272
04:56:28.858327 IP 138.197.171.102.22 > 162.243.188.66.9029: Flags [P.], seq 15728:15792, ack 1, win 502, options [nop,nop,TS val 1273263042 ecr 3283403296], length 64
04:56:28.870097 IP 162.243.188.66.9029 > 138.197.171.102.22: Flags [.], ack 10640, win 489, options [nop,nop,TS val 3283403380 ecr 1273263039], length 0
04:56:28.870719 IP 162.243.188.66.9029 > 138.197.171.102.22: Flags [.], ack 12304, win 476, options [nop,nop,TS val 3283403381 ecr 1273263040], length 0
04:56:28.871408 IP 162.243.188.66.9029 > 138.197.171.102.22: Flags [.], ack 14032, win 463, options [nop,nop,TS val 3283403382 ecr 1273263040], length 0
04:56:28.872218 IP 162.243.188.66.9029 > 138.197.171.102.22: Flags [.], ack 15728, win 450, options [nop,nop,TS val 3283403383 ecr 1273263041], length 0
04:56:28.915606 IP 162.243.188.66.9029 > 138.197.171.102.22: Flags [.], ack 15792, win 486, options [nop,nop,TS val 3283403426 ecr 1273263042], length 0
04:56:28.959715 IP 138.197.171.102.22 > 162.243.188.66.9029: Flags [P.], seq 15792:16016, ack 1, win 502, options [nop,nop,TS val 1273263143 ecr 3283403426], length 224
04:56:28.959953 IP 138.197.171.102.22 > 162.243.188.66.9029: Flags [P.], seq 16016:16080, ack 1, win 502, options [nop,nop,TS val 1273263143 ecr 3283403426], length 64
04:56:28.959977 IP 138.197.171.102.22 > 162.243.188.66.9029: Flags [P.], seq 16080:16304, ack 1, win 502, options [nop,nop,TS val 1273263143 ecr 3283403426], length 224
04:56:28.960289 IP 138.197.171.102.22 > 162.243.188.66.9029: Flags [P.], seq 16304:16944, ack 1, win 502, options [nop,nop,TS val 1273263144 ecr 3283403426], length 640
04:56:28.960557 IP 138.197.171.102.22 > 162.243.188.66.9029: Flags [P.], seq 16944:17456, ack 1, win 502, options [nop,nop,TS val 1273263144 ecr 3283403426], length 512
04:56:28.960715 IP 138.197.171.102.22 > 162.243.188.66.9029: Flags [P.], seq 17456:17808, ack 1, win 502, options [nop,nop,TS val 1273263144 ecr 3283403426], length 352
04:56:28.960862 IP 138.197.171.102.22 > 162.243.188.66.9029: Flags [P.], seq 17808:18096, ack 1, win 502, options [nop,nop,TS val 1273263144 ecr 3283403426], length 288
04:56:28.961013 IP 138.197.171.102.22 > 162.243.188.66.9029: Flags [P.], seq 18096:18384, ack 1, win 502, options [nop,nop,TS val 1273263144 ecr 3283403426], length 288
04:56:28.961154 IP 138.197.171.102.22 > 162.243.188.66.9029: Flags [P.], seq 18384:18672, ack 1, win 502, options [nop,nop,TS val 1273263145 ecr 3283403426], length 288
04:56:28.961346 IP 138.197.171.102.22 > 162.243.188.66.9029: Flags [P.], seq 18672:18896, ack 1, win 502, options [nop,nop,TS val 1273263145 ecr 3283403426], length 224
04:56:28.961459 IP 138.197.171.102.22 > 162.243.188.66.9029: Flags [P.], seq 18896:19184, ack 1, win 502, options [nop,nop,TS val 1273263145 ecr 3283403426], length 288
04:56:28.961601 IP 138.197.171.102.22 > 162.243.188.66.9029: Flags [P.], seq 19184:19248, ack 1, win 502, options [nop,nop,TS val 1273263145 ecr 3283403426], length 64
04:56:28.961672 IP 138.197.171.102.22 > 162.243.188.66.9029: Flags [P.], seq 19248:19472, ack 1, win 502, options [nop,nop,TS val 1273263145 ecr 3283403426], length 224
04:56:28.961744 IP 138.197.171.102.22 > 162.243.188.66.9029: Flags [P.], seq 19472:19536, ack 1, win 502, options [nop,nop,TS val 1273263145 ecr 3283403426], length 64
04:56:28.961863 IP 138.197.171.102.22 > 162.243.188.66.9029: Flags [P.], seq 19536:19760, ack 1, win 502, options [nop,nop,TS val 1273263145 ecr 3283403426], length 224
04:56:28.962101 IP 138.197.171.102.22 > 162.243.188.66.9029: Flags [P.], seq 19760:20048, ack 1, win 502, options [nop,nop,TS val 1273263146 ecr 3283403426], length 288
04:56:28.962253 IP 138.197.171.102.22 > 162.243.188.66.9029: Flags [P.], seq 20048:20336, ack 1, win 502, options [nop,nop,TS val 1273263146 ecr 3283403426], length 288
04:56:28.962384 IP 138.197.171.102.22 > 162.243.188.66.9029: Flags [P.], seq 20336:20688, ack 1, win 502, options [nop,nop,TS val 1273263146 ecr 3283403426], length 352
04:56:28.962510 IP 138.197.171.102.22 > 162.243.188.66.9029: Flags [P.], seq 20688:20976, ack 1, win 502, options [nop,nop,TS val 1273263146 ecr 3283403426], length 288
04:56:28.962636 IP 138.197.171.102.22 > 162.243.188.66.9029: Flags [P.], seq 20976:21264, ack 1, win 502, options [nop,nop,TS val 1273263146 ecr 3283403426], length 288
04:56:28.962764 IP 138.197.171.102.22 > 162.243.188.66.9029: Flags [P.], seq 21264:21776, ack 1, win 502, options [nop,nop,TS val 1273263146 ecr 3283403426], length 512
04:56:28.962900 IP 138.197.171.102.22 > 162.243.188.66.9029: Flags [P.], seq 21776:21840, ack 1, win 502, options [nop,nop,TS val 1273263146 ecr 3283403426], length 64
04:56:28.962966 IP 138.197.171.102.22 > 162.243.188.66.9029: Flags [P.], seq 21840:22064, ack 1, win 502, options [nop,nop,TS val 1273263146 ecr 3283403426], length 224
04:56:28.963055 IP 138.197.171.102.22 > 162.243.188.66.9029: Flags [P.], seq 22064:22128, ack 1, win 502, options [nop,nop,TS val 1273263146 ecr 3283403426], length 64
04:56:28.963186 IP 138.197.171.102.22 > 162.243.188.66.9029: Flags [P.], seq 22128:22352, ack 1, win 502, options [nop,nop,TS val 1273263147 ecr 3283403426], length 224
04:56:28.963286 IP 138.197.171.102.22 > 162.243.188.66.9029: Flags [P.], seq 22352:22416, ack 1, win 502, options [nop,nop,TS val 1273263147 ecr 3283403426], length 64
04:56:28.963406 IP 138.197.171.102.22 > 162.243.188.66.9029: Flags [P.], seq 22416:22928, ack 1, win 502, options [nop,nop,TS val 1273263147 ecr 3283403426], length 512
04:56:28.963527 IP 138.197.171.102.22 > 162.243.188.66.9029: Flags [P.], seq 22928:23216, ack 1, win 502, options [nop,nop,TS val 1273263147 ecr 3283403426], length 288
04:56:28.963704 IP 138.197.171.102.22 > 162.243.188.66.9029: Flags [P.], seq 23216:23280, ack 1, win 502, options [nop,nop,TS val 1273263147 ecr 3283403426], length 64
04:56:28.963768 IP 138.197.171.102.22 > 162.243.188.66.9029: Flags [P.], seq 23280:23488, ack 1, win 502, options [nop,nop,TS val 1273263147 ecr 3283403426], length 208
04:56:28.963866 IP 138.197.171.102.22 > 162.243.188.66.9029: Flags [P.], seq 23488:23552, ack 1, win 502, options [nop,nop,TS val 1273263147 ecr 3283403426], length 64
04:56:28.963975 IP 138.197.171.102.22 > 162.243.188.66.9029: Flags [P.], seq 23552:23824, ack 1, win 502, options [nop,nop,TS val 1273263147 ecr 3283403426], length 272
04:56:28.964096 IP 138.197.171.102.22 > 162.243.188.66.9029: Flags [P.], seq 23824:24096, ack 1, win 502, options [nop,nop,TS val 1273263148 ecr 3283403426], length 272
04:56:28.964206 IP 138.197.171.102.22 > 162.243.188.66.9029: Flags [P.], seq 24096:24368, ack 1, win 502, options [nop,nop,TS val 1273263148 ecr 3283403426], length 272
04:56:28.964325 IP 138.197.171.102.22 > 162.243.188.66.9029: Flags [P.], seq 24368:24640, ack 1, win 502, options [nop,nop,TS val 1273263148 ecr 3283403426], length 272
04:56:28.974548 IP 162.243.188.66.9029 > 138.197.171.102.22: Flags [.], ack 17456, win 495, options [nop,nop,TS val 3283403485 ecr 1273263143], length 0
04:56:28.975378 IP 162.243.188.66.9029 > 138.197.171.102.22: Flags [.], ack 19184, win 482, options [nop,nop,TS val 3283403486 ecr 1273263144], length 0
04:56:28.976311 IP 162.243.188.66.9029 > 138.197.171.102.22: Flags [.], ack 20688, win 471, options [nop,nop,TS val 3283403487 ecr 1273263145], length 0
04:56:28.977261 IP 162.243.188.66.9029 > 138.197.171.102.22: Flags [.], ack 22352, win 458, options [nop,nop,TS val 3283403488 ecr 1273263146], length 0
04:56:28.977993 IP 162.243.188.66.9029 > 138.197.171.102.22: Flags [.], ack 23824, win 447, options [nop,nop,TS val 3283403488 ecr 1273263147], length 0
04:56:28.997505 IP 162.243.188.66.9029 > 138.197.171.102.22: Flags [.], ack 24640, win 501, options [nop,nop,TS val 3283403508 ecr 1273263148], length 0
04:56:29.063468 IP 138.197.171.102.22 > 162.243.188.66.9029: Flags [P.], seq 24640:24864, ack 1, win 502, options [nop,nop,TS val 1273263247 ecr 3283403508], length 224
04:56:29.063635 IP 138.197.171.102.22 > 162.243.188.66.9029: Flags [P.], seq 24864:25152, ack 1, win 502, options [nop,nop,TS val 1273263247 ecr 3283403508], length 288
04:56:29.063827 IP 138.197.171.102.22 > 162.243.188.66.9029: Flags [P.], seq 25152:25712, ack 1, win 502, options [nop,nop,TS val 1273263247 ecr 3283403508], length 560
04:56:29.063996 IP 138.197.171.102.22 > 162.243.188.66.9029: Flags [P.], seq 25712:26112, ack 1, win 502, options [nop,nop,TS val 1273263247 ecr 3283403508], length 400
04:56:29.064125 IP 138.197.171.102.22 > 162.243.188.66.9029: Flags [P.], seq 26112:26336, ack 1, win 502, options [nop,nop,TS val 1273263248 ecr 3283403508], length 224
04:56:29.064291 IP 138.197.171.102.22 > 162.243.188.66.9029: Flags [P.], seq 26336:26896, ack 1, win 502, options [nop,nop,TS val 1273263248 ecr 3283403508], length 560
04:56:29.064417 IP 138.197.171.102.22 > 162.243.188.66.9029: Flags [P.], seq 26896:27296, ack 1, win 502, options [nop,nop,TS val 1273263248 ecr 3283403508], length 400
04:56:29.064540 IP 138.197.171.102.22 > 162.243.188.66.9029: Flags [P.], seq 27296:27696, ack 1, win 502, options [nop,nop,TS val 1273263248 ecr 3283403508], length 400
04:56:29.064692 IP 138.197.171.102.22 > 162.243.188.66.9029: Flags [P.], seq 27696:28256, ack 1, win 502, options [nop,nop,TS val 1273263248 ecr 3283403508], length 560
04:56:29.064814 IP 138.197.171.102.22 > 162.243.188.66.9029: Flags [P.], seq 28256:28480, ack 1, win 502, options [nop,nop,TS val 1273263248 ecr 3283403508], length 224
04:56:29.064928 IP 138.197.171.102.22 > 162.243.188.66.9029: Flags [P.], seq 28480:28704, ack 1, win 502, options [nop,nop,TS val 1273263248 ecr 3283403508], length 224
04:56:29.065068 IP 138.197.171.102.22 > 162.243.188.66.9029: Flags [P.], seq 28704:29104, ack 1, win 502, options [nop,nop,TS val 1273263248 ecr 3283403508], length 400
04:56:29.065363 IP 138.197.171.102.22 > 162.243.188.66.9029: Flags [P.], seq 29104:29504, ack 1, win 502, options [nop,nop,TS val 1273263249 ecr 3283403508], length 400
04:56:29.065732 IP 138.197.171.102.22 > 162.243.188.66.9029: Flags [P.], seq 29504:32048, ack 1, win 502, options [nop,nop,TS val 1273263249 ecr 3283403508], length 2544
04:56:29.065924 IP 138.197.171.102.22 > 162.243.188.66.9029: Flags [P.], seq 32048:32416, ack 1, win 502, options [nop,nop,TS val 1273263249 ecr 3283403508], length 368
04:56:29.078039 IP 162.243.188.66.9029 > 138.197.171.102.22: Flags [.], ack 26112, win 498, options [nop,nop,TS val 3283403588 ecr 1273263247], length 0
04:56:29.080268 IP 162.243.188.66.9029 > 138.197.171.102.22: Flags [.], ack 27696, win 486, options [nop,nop,TS val 3283403589 ecr 1273263248], length 0
04:56:29.080268 IP 162.243.188.66.9029 > 138.197.171.102.22: Flags [.], ack 29504, win 472, options [nop,nop,TS val 3283403590 ecr 1273263248], length 0
04:56:29.080514 IP 162.243.188.66.9029 > 138.197.171.102.22: Flags [.], ack 32048, win 454, options [nop,nop,TS val 3283403590 ecr 1273263249], length 0
04:56:29.104531 IP 162.243.188.66.9029 > 138.197.171.102.22: Flags [.], ack 32416, win 501, options [nop,nop,TS val 3283403615 ecr 1273263249], length 0
^C
146 packets captured
157 packets received by filter
0 packets dropped by kernel